KnessetNum,Year,Month,Day,Diplomacy_score,Ecologics_score,Economics_score,Education_score,Health_score,Security_score,CommitteeSessionID,Number,Mks,Topics,CommitteeID
16,2003,03,17,0,9,2,8,1,29,64550,4,738;745;749;729;730;92,שדה התעופה בהרצליה - כפר שמריהו,24
16,2003,03,11,0,31,0,6,21,14,64551,2,738;35;740;7;748;92;733,הזרמת מי שופכין לים תיכון ,24
16,2003,03,24,2,1,10,6,4,9,64557,6,98;26;35;196;745;121;730;92,פגישת הכרות וסקירת שר הפנים על פעולות משרדו,24
16,2003,03,25,8,0,16,1,0,28,64558,7,730;740;757;230,מעמדם של אנשי צד"ל,24
16,2003,03,26,2,71,3,1,4,2,64559,10,738;729;26;92;730,פגישת הכרות וסקירת השרה לאיכות הסביבה על פעולות משרדה,24
16,2003,03,24,1,1,8,11,0,6,64564,4,137;747;100;206,תקנות המרכז לגבית קנסות אגרות והוצאות (קבלת מידע מאת רשות מס) התשס"ג - 2003 ; תקנות למניעת העסקה של עברייני מין במוסד המכוון למתן שירות לקטינים (אישור המשטרה) השתס"ג - 2003,25
16,2003,03,25,2,0,1,2,0,6,64565,5,100;744;201;747;206;112;19;725;697;58;92;29;734;735,הערכות הכנסת לקראת השינוי המשמעותי הצפוי בהרכב בית המשפט העליון,25
16,2003,03,26,0,0,1,1,5,4,64566,7,747;29;206,כללי לשכת עורכי הדין (עיסוק אחר) התשס"ג - 2003,25
16,2003,03,24,0,0,7,6,3,22,64570,2,737;743;203;726;734,המאבק בתאונות הדרכים - אכיפת עבירות התנועה,23
16,2003,03,25,3,0,12,4,0,2,64573,3,64;748;208;723;726;89;58;734,שינוי במדיניות העמלות של חברת אל-על וההשלכות על ענף התיירות,23
16,2003,03,26,0,0,1,5,1,0,64577,6,744;137;747;725;92,שאילתא בוועדה: עיכובים בטיפול בתיקי נוער בבתי משפט השלום,25
16,2003,03,24,1,0,50,9,1,2,64580,9,697;91;723;742,כוונת משרד האוצר לבטל יישום דו"ח וינוגרד (שכר לימוד באוניברסיטאות),27
16,2003,03,23,1,3,0,0,1,0,64586,5,729;738,השטחים הירוקים מול פיתוח העיר,24
16,2003,03,26,0,0,11,92,0,5,64593,10,64;35;197;713;753;727;697;91;222;126,"דיון מהיר" של חה"כ מאיר פרוש בנושא: הודעת שרת החינוך על פיטורי אלפי מורים,27
16,2003,03,25,0,0,8,4,1,41,64594,8,736;35;100;26;740;7;103;745;744;743;732;725;117;727;726;757;730;22;92;733,חוק הרשויות המקומיות (בחירות ברשויות מקומיות מסוימות) (הוראת שעה) התשס"ג-2003,24
16,2003,03,12,0,0,2,2,0,4,64522,3,744;137;747;19;725;697;92;734,דיון בסדרי עבודת הוועדה,25
16,2003,03,10,0,0,1,4,0,5,64524,1,742;713;9;725;697;91;222;734,בחירת יו"ר הוועדה,27
16,2003,03,10,0,0,0,36,1,22,64525,2,736;64;742;713;723;91;222;734,מוכנות מערכת החינוך לקראת התקפת טילים מעירק,27
16,2003,03,12,1,0,0,0,0,10,64526,3,736;713;753,סרוב איגוד טניס שולחן מאשדוד להגיע לשדרות מפאת חשש טילים,27
16,2003,03,23,2,0,11,94,1,5,64527,6,697;91;753;734,סיור ועדת החינוך והתרבות,27
16,2003,03,10,0,0,0,1,0,0,64532,1,100;744;201;747;206;752;19;725;92;734;735,בחירת יושב-ראש ועדה,25
16,2003,03,11,0,0,0,2,0,1,64534,2,100;744;201;747;206;112;725;92;734;735,דיון בסדרי עבודת הוועדה,25
16,2003,03,12,0,1,0,0,15,39,64540,3,740;745;757;729;92;733,צו להסדרת הבטחון בגופים ציבוריים,24
16,2003,03,16,0,0,0,8,1,8,64542,4,197;230;713;727;697,סיור ועדת החינוך והתרבות,27
16,2003,10,27,0,0,0,0,0,12,65448,80,744;137;100;201,תקנות בתי המשפט (בקשה לאיסור פרסום שם חשוד) התשס"ג - 2003,25
16,2003,10,27,0,0,4,2,0,1,65452,77,209;58;743,צו הגנת הצרכן (סימון טובין) (תיקון) התשס"ג-2003,23
16,2003,10,29,1,0,21,2,3,5,65456,80,737;58;123;743,פתיחת "נתב"ג 2000" (טרמינל 3) והמכרזים להפעלת הדיוטי-פרי,23
16,2003,10,27,0,2,0,0,0,1,65457,80,740;230;743;749;208;756;26,ביטול אכרזה על שטחים המהווים חלק מגן לאומי הכרמל לפי תכנית מס' חכ/294,24
16,2003,10,28,5,1,0,1,4,36,65462,15,,הברחות סמים מגבול מצרים.,33
16,2003,11,03,0,0,70,3,0,3,65463,82,66;743;203;748;715;58,תקנות רישום קבלנים לעבודות הנדסה בנאיות (קביעת ענפים וחלוקת ענפים לענפי משנה) (תיקון מס' 2) התשס"ג-2003 ; התוכניות ליציאה מהמשבר בענף הבניה ; תקנות רישום קבלנים לעבודות הנדסה בנאיות (אגרת רשיון) (תיקון) התשס"ג-2003,23
16,2003,11,03,1,0,6,69,0,4,65475,87,753;91;197;742,מעבר לשבוע לימודים של 5 ימים,27
16,2003,11,02,0,0,0,0,0,0,65478,2,,,73
16,2003,11,03,0,0,0,4,2,0,65479,83,100,חוק העונשין (תיקון מס' 77) התשס"ד-2003,25
16,2003,11,04,0,0,0,1,0,0,65480,84,744;206;112;209;92,הצעת חוק לתיקון פקודת הנזיקין (תיקון מס' 12) (הגדרת בן זוג) התשס"ד-2003,25
16,2003,11,03,0,0,1,1,0,0,65483,82,744;100,חוק ההוצאה לפועל (תיקון מס' 24) (תיקון) התשס"ד-2003,25
16,2003,11,18,2,105,0,5,13,3,65585,11,729;757;121,זיהום תחבורתי,79
16,2003,11,18,0,0,0,0,0,0,65628,90,,אישור החלטה לפי סעיף 121 לתקנון הכנסת - הצעת חוק הרשויות המקומיות (מימון בחירות) (תיקון מס' 25 והוראת שעה),24
16,2003,11,26,6,0,22,4,3,1,65630,97,66;743;123;203;91,תוכניות לעידוד הצמיחה במשק,23
16,2003,11,26,3,0,27,3,0,0,65631,98,66;743;123;203;91;734,העברת 3 מיליארד ש"ח  מן הממשלה לסוכנות עבור מכירת דירות בדיור הציבורי דיון מהיר בהצעתו של ח"כ רן כהן,23
16,2003,11,23,1,0,2,3,3,6,65636,96,112;209;747;725,חוקה בהסכמה רחבה,25
16,2003,11,24,0,0,0,1,0,7,65637,97,206,חוק הירושה (תיקון מס' 11) התשס"ד-2004 ; חוק משפחות חיילים שנספו במערכה (תגמולים ושיקום) (תיקון מס' 26) התשס"ד-2004 ; חוק משפחות חיילים שנספו במערכה (תגמולים ושיקום) (תיקון מס' 25) התשס"ד-2004,25
16,2003,11,25,0,0,4,8,1,1,65638,98,100,חוק נושאי משרה שיפוטית (מניעה מלשבת בדין) (תיקוני חקיקה) התשס"ד-2004,25
16,2003,11,25,0,5,0,0,1,0,65639,99,100,תקנות העבירות המנהליות (קנס מנהלי - אגודות שיתופיות) התשס"ד - 2003 ; צו סדר הדין הפלילי (עבירות קנס - פינוי יריעות פלסטיק) התשס"ד - 2003 ; צו סדר הדין הפלילי (ברירת משפט - פינוי יריעות פלסטיק) התשס"ד - 2003,25
16,2003,11,26,0,0,0,1,0,7,65640,100,100;744;137;206;725,חוק להסדרת סמכות לכבילת עצור או אסיר במקום ציבורי (תיקוני חקיקה) התשס"ד-2003,25
16,2003,11,25,0,0,0,0,3,75,65642,92,218;91,אלימות שוטרים וסוהרים כלפי עצירים ואסירים,24
16,2003,11,26,0,12,0,4,0,5,65644,93,220;739;748;749,הצעת חוק שמירת הסביבה החופית התשס"ג-2003,24
16,2003,11,25,3,0,3,18,19,2,65670,28,753,טיפול המדינה בקטינים (מתחת לגיל 12) הפוגעים מינית,35
16,2003,12,02,3,0,0,10,76,3,65680,29,,ילדים להורים פגועי נפש,35
16,2003,11,30,4,0,2,2,2,1,65681,106,121;740;742;713;729,סיור בת"א - "העיר הלבנה",27
16,2003,12,01,7,0,18,125,8,8,65682,107,35;742;713;753;126;91;222,הפורום לאחריות לאומית לרפורמה מבנית במערכת החינוך,27
16,2003,12,01,0,0,0,79,20,3,65683,108,736;742;748;723;126,יום האיידס הבינלאומי- הסברה בבתיה"ס על מחלת האיידס,27
16,2003,12,02,0,0,1,107,17,4,65684,109,35;37;742;753;723;126,הטיפול הכולל בתלמידים לקויי למידה - היום הבינלאומי לאנשים עם מוגבלויות,27
16,2003,12,02,0,0,2,1,4,64,65688,99,64;713;729,הצעת חוק מאבטחים אזרחיים התשס"ג-2003 ; הצעת חוק ממוני ביטחון התשס"ג-2003,24
16,2003,12,03,0,1,11,5,4,2,65689,100,739;35;7;13;749;757,הקמת ועדת משנה לנושא הערים לוד עכו ; הצעת חוק המדיניות הכלכלית לשנת הכספים 2004 (תיקוני חקיקה) התשס"ד-2003 - פרק ג' - תכנון ובניה,24
16,2003,12,02,4,14,2,0,25,6,65690,12,729;35;121,חומרי הדברה בחקלאות,79
16,2003,12,04,1,0,3,9,0,3,65692,112,736;738;742;723;727;697;126,סיור בטלוויזיה החינוכית,27
16,2003,12,01,0,0,8,2,0,1,65693,101,206,חוק החברות (תיקון מס' 2) התשס"ד-2003,25
16,2003,12,02,0,0,0,0,0,0,65694,104,100;744;747;112;209;725,ייצוג הולם בשירות המדינה לאנשים עם מוגבלות,25
16,2003,12,03,0,0,0,2,0,3,65695,105,100;744;137;206;112;209,חוק שיפוט בענייני התרת נישואין (מקרים מיוחדים וסמכות בינלאומית) (תיקוני חקיקה) התשס"ה-2005,25
16,2003,12,03,1,0,0,9,1,9,65697,30,736;91,איתור נערות בסיכון הבורחות ממוסדות,35
16,2003,12,01,0,0,0,1,1,0,65703,102,206,צו העיריות (עבירות קנס) (תיקון) התשס"ג - עירית תל-אביב -יפו,25
16,2003,12,01,8,0,0,0,1,26,65705,25,737;206,הברחות סמים מהרשות הפלשתינית לישראל.,33
16,2003,12,01,0,1,41,6,2,1,65712,99,737;743;209;50;58,הצעת חוק המדיניות הכלכלית לשנת הכספים 2004 (תיקוני חקיקה) התשס"ד-2003 (מיועדת רק לצורך חלוקת הצעת החוק)  ; הצעת חוק המים (תיקון מס' ___) (שינויים בענין רשות המים הארצית) התשס"ד-2004 [סעיפים 90 (2) ו- 91 להצעת חוק המדיניות הכלכלית לשנת הכספים 2004 (תיקוני חקיקה) התשס"ד-2003] ; סעיפים 90-91 להצעת חוק המדיניות הכלכלית לשנת הכספים 2004 (תיקוני חקיקה) התשס"ד-2003 - תיקון חוק המים ; סעיף 95 להצעת חוק המדיניות הכלכלית לשנת הכספים 2004 (תיקוני חקיקה) התשס"ד-2003 - תיקון חוק הפיקוח על מצרכים ושירותים,23
16,2003,12,10,0,5,5,0,0,2,65728,110,35;58;203;208;209;50;730;732;733;734,תוכניות הפיתוח של משרד התחבורה (בדגש על הרכבת וכביש 6),23
16,2003,12,08,14,0,14,1,1,5,65729,103,737;203;717,מחירי החלב בישראל ובעולם,23
16,2003,12,02,0,0,0,0,0,0,65735,103,100;744;747;112;209;725,קביעת מספר השופטים בבית המשפט העליון,25
16,2003,12,09,0,0,3,0,0,1,65741,108,209;58,תקנות מקורות אנרגיה (יעילות אנרגטית וסימון אנרגטי במזגנים) (תיקון) התשס"ד-2003,23
16,2003,11,30,4,0,2,2,2,1,65742,95,121;740;742;713;729,הענקת התואר "העיר הלבנה" לעיר ת"א ע"י ארגון אונסק"ו העולמי,24
16,2003,12,09,0,0,7,1,0,1,65743,109,748,תקנות מינהל מקרקעי ישראל (מאגר המידע) התשס"ג-2003,23
16,2003,12,08,0,0,25,2,2,1,65744,105,743;203;50;723;726;58,הצעת חוק רשות הדואר (תיקון מס'...)(בנק הדואר) התשס"ד-2004 [חלק מסעיף 63(49) להצעת חוק המדיניות הכלכלית לשנת הכספים 2004 (תיקוני חקיקה) התשס"ד-2003 ] ; סעיפים 79-63 להצעת חוק המדיניות הכלכלית לשנת הכספים 2004 (תיקוני חקיקה) התשס"ד-2003 - תיקון פרק י''א: דואר,23
16,2003,12,08,0,0,22,0,2,0,65748,108,137;747;209;734,דין וחשבון על פעילות לשכות ההוצאה לפועל,25
16,2003,12,09,14,0,2,2,6,29,65749,109,100;197;201;13;206;112;209;19;697;218;91;220;29,ישיבה חגיגית לציון יום זכויות האדם הבינלאומי,25
16,2003,12,09,3,0,0,2,0,4,65750,110,100;8;137;744;201;747;13;206;112;209;114;19;725;697;58;92;735,קביעת מספר השופטים בבית המשפט העליון,25
16,2003,12,10,0,0,1,2,4,32,65751,111,100;7;201;112;697;29,זכויות האדם בישראל - תמונת מצב לשנת 2003,25
16,2003,12,08,0,0,2,75,0,2,65753,114,,הסעות תלמידים לבית ספר בתפן - הצעת ח"כ רשף חן ל"דיון מהיר",27
16,2003,12,08,0,0,0,65,0,2,65754,115,197;230;742;13;756;126,השבתת בי"ס חטיבת ביניים אלון תל-שבע ותנאי הלימודים בבית הספר - הצעת ח"כ ג'מאל זחאלקה ל"דיון מהיר",27
16,2003,12,08,0,0,6,9,1,0,65756,32,,הפעלת משפחתונים במגזר הערבי,35
16,2003,12,09,8,0,0,6,8,4,65793,28,,העליה הדרסטית בשימוש בסמים בקרב סטודנטים בישראל,33
16,2003,12,17,0,0,22,6,0,0,65797,113,209;58;123;741,סעיף 95 להצעת חוק המדיניות הכלכלית לשנת הכספים 2004 (תיקוני חקיקה) התשס"ד-2003 - תיקון חוק הפיקוח על מצרכים ושירותים,23
16,2003,12,15,0,0,12,3,0,0,65799,111,58,הצעת חוק המים (תיקון מס' ___) (שינויים בענין רשות המים הארצית) התשס"ד-2004 [סעיפים 90 (2) ו- 91 להצעת חוק המדיניות הכלכלית לשנת הכספים 2004 (תיקוני חקיקה) התשס"ד-2003] ; סעיפים 90-91 להצעת חוק המדיניות הכלכלית לשנת הכספים 2004 (תיקוני חקיקה) התשס"ד-2003 - תיקון חוק המים,23
16,2003,12,16,0,0,12,3,0,2,65800,1,228;740;7;757;218,תוכניות משרד ראש הממשלה לשיקום הערים לוד-עכו,81
16,2004,01,13,0,104,0,0,9,13,65895,16,216;92;740,טיפול משרד הבטחון בזיהום מי תהום,79
16,2004,01,06,0,0,6,12,25,1,65896,124,230;203;748;209;58;734,צו הגבלת הפרסומת למוצרי טבק לעישון (שינוי נוסח אזהרה) (תיקון מס' 2) התשס"ג-2003 ; צו הגנת הצרכן (סימון טובין) (תיקון) התשס"ד-2003 בדבר איסור השימוש במילה "לייט" ודומיה על מוצרי הטבק ; הצעת חוק העונשין (תיקון - איסור מכירת מוצרי טבק לקטין) התשס"ג-2003,23
16,2004,01,07,0,1,3,1,0,6,65897,125,58;743,הצעת חוק משק הדלק (הגבלת מכירה לתחנות תדלוק הפועלות שלא כדין) התשס"ג-2003 ; חוק משק הדלק (איסור מכירת דלק לתחנות תדלוק מסוימות) התשס"ה-2005,23
16,2003,12,24,0,0,15,0,0,0,65903,121,209;58;123;743,הצעת חוק המים (תיקון מס' ___) (שינויים בענין רשות המים הארצית) התשס"ד-2004 [סעיפים 90 (2) ו- 91 להצעת חוק המדיניות הכלכלית לשנת הכספים 2004 (תיקוני חקיקה) התשס"ד-2003] ; סעיפים 90-91 להצעת חוק המדיניות הכלכלית לשנת הכספים 2004 (תיקוני חקיקה) התשס"ד-2003 - תיקון חוק המים,23
16,2003,12,31,0,1,1,77,0,0,65907,130,126;742,פרוייקט אומץ - הצעת ח"כ יולי תמיר לדיון מהיר,27
16,2004,01,01,0,0,7,54,0,2,65908,131,713;697;126;742,דיון במרכז השלטון המקומי - בדיקת החינוך בשלטון המקומי עקב גזרות התקציב,27
16,2003,12,30,0,1,1,1,0,0,65911,119,,,24
16,2003,12,29,0,0,0,2,3,7,65912,2,121;212,בניה בלתי חוקית בלוד,81
16,2004,01,14,0,0,5,0,0,3,65913,131,230;13;757;218;92,קרקעות המדינה במזרח ירושלים,24
16,2003,12,29,6,0,7,1,4,34,65914,118,728;201;749;7,חוק לתיקון פקודת בתי הסוהר (מס' 28) התשס"ד-2004,24
16,2003,12,29,3,0,1,14,2,108,65918,123,137;697;100;209,חוקה בהסכמה רחבה,25
16,2003,12,29,0,0,19,0,0,2,65919,122,112;137;747,תקנות ההוצאה לפועל (אגרות שכר והוצאות) (תיקון) התשס"ב - 2002 (תיקון) התשס"ג - 2003,25
16,2003,12,30,0,0,39,0,1,2,65920,124,100;744;206;112;697,חוק לתיקון פקודת המסים (גבייה) (מס' 5) התשס"ד-2004,25
16,2003,12,30,0,0,0,0,0,2,65921,125,744;206;112;753;209,הצעת חוק העונשין (תיקון - איסור מכירת משקאות משכרים לקטין) התשס"ג-2003 ; חוק העונשין (תיקון מס' 79) התשס"ד-2004,25
16,2004,01,18,0,0,0,0,0,0,65925,None,,סיור הוועדה למסיל"ה,34
16,2003,12,29,0,0,10,28,1,4,65926,128,64;35;197;717;753;723;727;697;126;91;220;222;734,המשבר החינוכי ברשויות המקומיות - סכנה לשביתה,27
16,2003,12,29,4,0,1,1,5,1,65929,36,,האם לאשר את סם הקאנביב כחוקי במדינה ישראל? - ישיבת המשך ב"אילנות",33
16,2003,12,31,1,0,4,1,8,70,65935,120,739;100;7;201;749;729,חוק לתיקון פקודת בתי הסוהר (מס' 28) התשס"ד-2004,24
16,2004,01,05,16,0,1,122,0,4,65947,133,,חינוך על יהדות התפוצות במסגרת תכנית הלימודים,27
16,2004,01,05,0,0,0,0,1,40,65950,123,26;36;7,אבטחת תחבורה ציבורית,24
16,2004,01,06,3,1,20,7,1,45,65952,124,64;740;230;203;92,מימדי האלימות והפשיעה בישראל,24
16,2004,01,06,0,0,0,25,0,0,65954,134,197;742;713;13;756;126,אישור החלטות דיון מהיר בנושא: השבתת ביה"ס חט"ב אלון תל שבע ותנאי הלימודים בביה"ס הצעת ח"כ ג'אמל זחאלקה,27
16,2004,01,07,4,2,21,225,3,5,65955,137,742,חינוך לאיכות סביבה,27
16,2004,01,06,0,1,2,9,2,4,65956,130,100;137;206;209;29,דין וחשבון שנתי של נציב שירות המדינה בנושא ייצוג הולם בקרב העובדים בשירות המדינה (סעיף 15א לחוק שירות המדינה) (מינויים),25
16,2004,01,07,0,0,0,1,0,1,65957,132,747,חוק המפלגות (תיקון מס' 13) התשס"ד-2004,25
16,2004,01,07,0,0,6,1,0,1,65958,133,747;212,הצעת חוק בחירות לגופים ציבוריים (תיקון מס' 4) (ועדת בחירות בארגוני עובדים ארגוני מעבידים ומפלגות) התשס"ד-2004,25
16,2003,12,31,0,0,0,1,0,0,65959,127,100;745;137;206;112;753;92,חוק הדיינים (תיקון מס' 20) התשס"ד-2004 ; חוק הרבנות הראשית לישראל (תיקון) התשס"ד-2004,25
16,2004,01,07,0,48,0,35,2,1,65962,125,,חינוך לאיכות הסביבה,24
16,2004,01,06,7,0,0,87,0,1,65963,135,35;742;713;753;91;126,הצבת עץ אשוח לחג המולד בביה"ס התיכון שליד האוניברסיטה,27
16,2004,01,06,0,0,0,8,0,0,65964,136,35;742;713;750;91;222;126,הטלת ספק ביהדות יוצאי ברה"מ לשעבר-ספר משרד החינוך התרבות והספורט בנושא 100 מושגי יסוד,27
16,2004,01,05,0,0,0,1,0,0,65967,121,,אישור תקנות הרשויות המקומיות (משמעת) (מקום מושבו של בית הדין וחלוקת הוצאות החזקתו) התשס"ד-2003,24
16,2004,01,05,0,0,2,2,0,19,65970,122,201;100;733;7,חוק לתיקון פקודת בתי הסוהר (מס' 28) התשס"ד-2004,24
16,2004,01,06,0,46,2,4,23,16,65975,15,26;739,מצבו של נחל הקישון והטיפול בו,79
16,2004,01,06,1,0,0,4,0,53,65976,131,121;713;752;209;697;92;734,צווים מיום 29/12/03 בדבר מבנים בלתי מורשים והוראות בדבר רכוש שפונה משטח מתוחם,25
16,2004,01,05,4,1,7,0,0,4,65977,122,100;203;748;50;58,בטיחות מכשירי הטלפון הסלולארי ואביזריהם,23
16,2004,01,13,0,0,181,5,0,3,65991,127,64;212;748;203,הצעת חוק הבנקאות (מועדי החזר של הלוואה לדיור) התשס"ג-2003 ; הצעת חוק הבנקאות (מועדי החזר של הלוואה לדיור) התשס"ג-2003,23
16,2004,01,12,0,0,1,39,5,49,65993,39,737,השבוע הבין-לאומי למלחמה בנגע הסמים  ,33
16,2004,01,13,0,0,0,11,1,60,65994,40,,צנחנים בצה"ל תחת השפעת סמים,33
16,2004,01,12,0,1,12,0,0,4,65995,126,737;743;203;112;723;726;58,תקנות התעבורה (תיקון מס'...) התשס"ג-2003 בדבר בין היתר הגדרת רכב מסחרי אחוד התקנת חגורות בטיחות באוטובוסים לסיור וטיול היתר הוראת נהיגה אזרחית למדריכים מצה"ל שימוש במחירון בנסיעות מיוחדות במונית השתתפותם במרכזים מפתח להפעלת מונית ; תקנות התעבורה (תיקון מס'...) התשס"ד-2003 בדבר ביטול ההסדרים המיוחדים למוניות מסוג זוטובוס ; תקנות התעבורה (תיקון מס' 8) התשס"ג-1993 (תיקון) התשס"ד-2003 בדבר ההסדר המיוחד למוניות מסוג זוטובוס וקביעת תקופת מעבר ; רפורמה בענף המוניות,23
16,2004,01,19,1,0,13,4,0,11,65997,132,64;203;748;209;723;58;734,הצעת חוק לתיקון פקודת זכות יוצרים (תיקון - סגירת חצרים ושלילת רשיון) התשס"ד-2003 ; הצעת חוק זכויות יוצרים ומבצעים (שיפוט בעניני תגמולים) התשס"א-2001,23
16,2004,01,13,2,1,9,234,1,3,66002,141,753;91;222;742,הכשרת המורה בישראל,27
16,2004,01,14,1,2,0,1,4,13,66003,142,126,שימור אתרים-מתחם שרונה בקריה בת"א,27
16,2004,01,15,1,15,6,142,2,3,66004,143,197;713;13;757;727,סיור בחינוך במגזר הערבי,27
16,2004,01,12,0,0,0,1,0,4,66005,126,91;230,התנהגות חוקי מחלק הנוער של משטרת תל-אביב,24
16,2004,01,13,1,0,4,10,0,0,66007,130,738;100;745;206;216,הצעת חוק קביעת מזוזה במבנה ציבור התשס"ד-2004,24
16,2004,01,12,0,0,0,2,0,5,66013,135,744;100;92,תקנות הסמים המסוכנים (דרכי הנהלת הקרן לטיפול בנכסים שחולטו) (תיקון) התשס"ד - 2003 ; חוק המפלגות (תיקון מס' 13) התשס"ד-2004,25
16,2004,01,12,0,0,10,3,0,1,66014,136,66;744;745;201;206;112;697;92,חוק הדיינים (תיקון מס' 20) התשס"ד-2004 ; חוק הרבנות הראשית לישראל (תיקון) התשס"ד-2004,25
16,2004,01,13,0,1,7,4,2,3,66015,137,112;697;100,חוקה בהסכמה רחבה,25
16,2004,01,15,2,0,3,1,0,14,66023,132,121,חוק לתיקון פקודת בתי הסוהר (מס' 28) התשס"ד-2004,24
16,2004,01,12,0,0,15,1,0,1,66050,89,8;9;19;35;58;64;66;197;201;208;725;91;732;92;734;737;228;741;230;103;744;745,הרכב ועדה משותפת ; שונות ; קביעת ועדות לדיון בהצעות חוק ובהצעות לסדר היום ; העברה מועדה לועדה - חוקים והצעות לסה"י,20
16,2004,01,26,0,0,0,0,0,0,66166,94,736;737;741;8;745;201;203;748;733;206;208;753;729;730;220;61;735,שונות ; קביעת ועדות לדיון בהצעות חוק ובהצעות לסדר היום ; תיקוני תקנון ; בקשת היועמ"ש לממשלה לנטילת חסינות מחבר כנסת ; בקשת היועץ המשפטי לממשלה לנטילת החסינות מחה"כ יחיאל חזן,20
16,2004,01,27,0,0,31,2,0,0,66169,150,9,תקנות החברות (שינוי החלטה שפורטה בהודעה על אסיפה כללית) התשס"ד - 2003,25
16,2004,01,27,0,0,0,4,0,1,66175,152,736;1;197;713;13;208;725;91;126,החזרת הפסיכומטרי כתנאי קבלה לאוניברסיטאות הצעה לסדר היום של ח"כ טיבי ח"כ בשארה ח"כ דהאמשה וח"כ תמיר-הצבעה על החלטות הוועדה,27
16,2004,01,26,0,0,0,0,0,1,66176,149,753;35;100;209,שאילתה בוועדה: מינויו של השופט בועז אוקון למנהל בתי המשפט,25
16,2004,02,02,1,0,0,35,33,1,66180,40,64;35;742;713;717;206;755;216;220;126,עישון נרגילה בקרב בני נוער,35
16,2004,01,27,0,0,8,0,0,0,66185,140,112;64;58;203,תוכניות משרד התקשורת למספור מחדש של הטלפונים,23
16,2004,02,02,4,31,13,5,1,7,66186,144,738;26,דיווח המשרד לאיכות הסביבה על ישום החלטת הממשלה בדבר פיתוח בר-קיימא,24
16,2004,02,03,1,62,10,0,5,11,66188,146,738;739;26;35;742;729;730,תקשורת ואיכות הסביבה,24
16,2004,02,03,0,0,3,0,0,0,66189,147,,חוק לתיקון פקודת העיריות (מס' 94) התשס"ד-2004,24
16,2004,02,02,0,0,0,0,0,0,66191,153,35;100;137;206;112;92,החלטה בדבר חידוש הדיון בוועדה בהצ"ח הרבנות הראשית לישראל (תיקון) התשס"ד - 2004 - עפ"י סעיף 124 לתקנון הכנסת - הצבעה,25
16,2004,02,02,0,0,8,0,2,16,66192,154,112;137;206;744,חוק איסור מימון טרור התשס"ה-2005,25
16,2004,02,03,0,0,0,2,0,1,66195,156,100;747;206;112;209;697,צמצום זכות השתיקה של נבחרי ציבור - דיון,25
16,2004,02,03,0,0,0,0,0,0,66196,159,744;112;209;725;92;735,חוק נושאי משרה שיפוטית (שיקול דעת של חברי ועדה לבחירת נושאי משרה שיפוטית) (תיקוני חקיקה) התשס"ד-2004,25
16,2004,02,04,1,2,8,7,1,5,66197,160,744;209;747,חוקה בהסכמה רחבה,25
